{
  "schema_version": "v1",
  "agent": "pi",
  "version": "0.84.4",
  "harbor_agent": {
    "import_path": "harbor_hf_agents.pi.agent:PiAgent",
    "kwargs": { "version": "0.84.4" }
  },
  "reasoning_option": "thinking",
  "reasoning_values": ["off", "minimal", "low", "medium", "high", "xhigh"],
  "endpoint_api": {
    "option": "model_api",
    "api": {
      "chat-completions": "openai-completions",
      "responses": "openai-responses"
    }
  }
}
