{
  "schema_version": "v1",
  "agent": "fx",
  "version": "0.0.5",
  "harbor_agent": {
    "import_path": "harbor_hf_agents.fx.agent:FxAgent",
    "kwargs": { "version": "0.0.5" }
  },
  "reasoning_option": "reasoning_effort",
  "reasoning_values": [
    "auto",
    "none",
    "minimal",
    "low",
    "medium",
    "high",
    "xhigh",
    "max"
  ]
}
